{
  "title": "SilverERP",
  "description": "elastic.io component for the SilverERP API",
  "docsUrl": "https://www.silvererp.com",
  "credentials": {
    "fields": {
      "apiKey": {
        "label": "API key",
        "required": true,
        "viewClass": "TextFieldWithNoteView",
        "note": "Please use the <b>silvererp</b> API key."
      }
    }
  },
  "triggers": {
    "getPersons": {
      "main": "./lib/triggers/getPersons.js",
      "type": "polling",
      "description": "Fetch all persons from silvererp",
      "title": "Get Persons",
      "metadata": {
        "out": "./lib/schemas/getPersons.out.json"
      }
    }
  },
  "actions": {
    "createPerson": {
      "main": "./lib/actions/createPerson.js",
      "title": "Create Person",
      "description": "Create a new person in snazzycontacts",
      "metadata": {
        "in": "./lib/schemas/createPerson.in.json",
        "out": "./lib/schemas/createPerson.out.json"
      }
    }
  }
}
